bibkey,url,bib_title,bib_doi,match_title,match_doi,title_match_ratio,same_doi,search_string
abel19,https://repository.ubn.ru.nl/handle/2066/215198,"Computational pathology definitions, best practices, and recommendations for regulatory guidance: a white paper from the Digital Pathology Association",https://doi.org/10.1002/path.5331,"Computational pathology definitions, best practices, and recommendations for regulatory guidance: a white paper from the Digital Pathology Association.",https://doi.org/10.1002/path.5331,0.9966777408637874,True,"Computational pathology definitions, best practices, and recommendations for regulatory guidance a white paper from the Digital Pathology Association Abels Pantanowitz Aeffner Zarella Laak Bui Vemuri Parwani Gibbs Agosto-Arroyo Beck Kozlowski"
amga20,https://repository.ubn.ru.nl/handle/2066/220833,Report on computational assessment of Tumor Infiltrating Lymphocytes from the International Immuno-Oncology Biomarker Working Group,https://doi.org/10.1038/s41523-020-0154-2,Report on computational assessment of Tumor Infiltrating Lymphocytes from the International Immuno-Oncology Biomarker Working Group,https://doi.org/10.1038/s41523-020-0154-2,1.0,True,Report on computational assessment of Tumor Infiltrating Lymphocytes from the International Immuno-Oncology Biomarker Working Group Amgad Stovgaard Balslev Thagaard Chen Dudgeon Sharma Kerner Denkert Yuan AbdulJabbar Wienert Savas Voorwerk Beck Madabhushi Hartman Sebastian Horlings Hudeček Ciompi Moore Singh Roblin Balancin Mathieu Lennerz Kirtani Chen Braybrooke Pruneri Demaria Adams Schnitt Lakhani Rojo Comerma Badve Khojasteh Symmans Sotiriou Gonzalez-Ericsson Pogue-Geile Kim Rimm Viale Hewitt Bartlett Penault-Llorca Goel Lien Loibl Kos Loi Hanna Michiels Kok Nielsen Lazar Bago-Horvath Kooreman Laak Saltz Gallas Kurkure Barnes Salgado Cooper
apru19,https://repository.ubn.ru.nl/handle/2066/202849,Robust and accurate quantification of biomarkers of immune cells in lung cancer micro-environment using deep convolutional neural networks,https://doi.org/10.7717/peerj.6335,Robust and accurate quantification of biomarkers of immune cells in lung cancer micro-environment using deep convolutional neural networks,https://doi.org/10.7717/peerj.6335,1.0,True,Robust and accurate quantification of biomarkers of immune cells in lung cancer micro-environment using deep convolutional neural networks Aprupe Litjens Brinker Laak Grabe
ares19,https://repository.ubn.ru.nl/handle/2066/207075,iW-Net: an automatic and minimalistic interactive lung nodule segmentation deep network,https://doi.org/10.1038/s41598-019-48004-8,iW-Net: an automatic and minimalistic interactive lung nodule segmentation deep network,https://doi.org/10.1038/s41598-019-48004-8,1.0,True,iW-Net an automatic and minimalistic interactive lung nodule segmentation deep network Aresta Jacobs Araujo Cunha Ramos Ginneken Campilho
arma18,,The PROSTATEx Challenges for Computerized Classification of Prostate Lesions from Multi-Parametric Magnetic Resonance Images,https://doi.org/10.1117/1.JMI.5.4.044501,,,,False,The PROSTATEx Challenges for Computerized Classification of Prostate Lesions from Multi-Parametric Magnetic Resonance Images Armato Huisman Drukker Hadjiiski Kirby Petrick Redmond Giger Cha Mamonov Kalpathy-Cramer Farahani
arta09,https://repository.ubn.ru.nl/handle/2066/79921,Airway segmentation and analysis for the study of mouse models of lung disease using micro-CT,https://doi.org/10.1088/0031-9155/54/22/017,Airway segmentation and analysis for the study of mouse models of lung disease using micro-CT.,https://doi.org/10.1088/0031-9155/54/22/017,0.9946524064171123,True,Airway segmentation and analysis for the study of mouse models of lung disease using micro-CT Artaechevarria Pérez-Martin Ceresa Biurrun Blanco Montuenga Ginneken Ortiz-de-Solórzano Muñoz-Barrutia
arzh10,https://repository.ubn.ru.nl/handle/2066/88430,Automated estimation of progression of interstitial lung disease in CT images,https://doi.org/10.1118/1.3264662,Automated estimation of progression of interstitial lung disease in CT images.,https://doi.org/10.1118/1.3264662,0.9935483870967742,True,Automated estimation of progression of interstitial lung disease in CT images Arzhaeva Prokop Murphy Rikxoort Jong Gietema Viergever Ginneken
baid18,https://repository.ubn.ru.nl/handle/2066/197167,Evaluating the benefits of digital pathology implementation: time savings in laboratory logistics,https://doi.org/10.1111/his.13691,Evaluating the benefits of digital pathology implementation: time savings in laboratory logistics,https://doi.org/10.1111/his.13691,1.0,True,Evaluating the benefits of digital pathology implementation time savings in laboratory logistics Baidoshvili Bucur Leeuwen Laak Kluin Diest
baid18a,,Validation of a whole-slide image-based teleconsultation network,https://doi.org/10.1111/his.13673,,,,False,Validation of a whole-slide image-based teleconsultation network Baidoshvili Stathonikos Freling Bart Hart Laak Doff Vegt Kluin  Philip Dies
balk19,https://repository.ubn.ru.nl/handle/2066/206059,Deep learning and manual assessment show that the absolute mitotic count does not contain prognostic information in triple negative breast cancer,https://doi.org/10.1007/s13402-019-00445-z,Deep learning and manual assessment show that the absolute mitotic count does not contain prognostic information in triple negative breast cancer,https://doi.org/10.1007/s13402-019-00445-z,1.0,True,Deep learning and manual assessment show that the absolute mitotic count does not contain prognostic information in triple negative breast cancer Balkenhol Bult Tellez Vreuls Clahsen Ciompi Laak
balk20,https://repository.ubn.ru.nl/handle/2066/221654,Histological subtypes in triple negative breast cancer are associated with specific information on survival,https://doi.org/10.1016/j.anndiagpath.2020.151490,Histological subtypes in triple negative breast cancer are associated with specific information on survival,https://doi.org/10.1016/j.anndiagpath.2020.151490,1.0,True,Histological subtypes in triple negative breast cancer are associated with specific information on survival Balkenhol Vreuls Wauters Mol Laak Bult
balk21,https://repository.ubn.ru.nl/handle/2066/220344,Optimized tumour infiltrating lymphocyte assessment for triple negative breast cancer prognostics.,https://doi.org/10.1016/j.breast.2021.02.007,Tissue-based biomarker assessment for predicting prognosis of triple negative breast cancer: the additional value of artificial intelligence,,0.4789915966386555,False,Optimized tumour infiltrating lymphocyte assessment for triple negative breast cancer prognostics. Balkenhol Ciompi Świderska-Chadaj Loo Intezar Otte-Höller Geijs Lotz Weiss Bel Litjens Bult Laak
bare99,https://repository.ubn.ru.nl/handle/2066/150169,Fast dynamic gadolinium-enhanced MR imaging of urinary bladder and prostate cancer,https://doi.org/10.1002/(SICI)1522-2586(199909)10:3&lt;295::AID-JMRI10&gt;3.0.CO;2-Z,1H and 31P MR Spectroscopic Imaging of the prostate at 7 Tesla,,0.4444444444444444,False,Fast dynamic gadolinium-enhanced MR imaging of urinary bladder and prostate cancer Barentsz Engelbrecht Jager Witjes LaRosette Der  Sanden Huisman Heerschap
bejn14,https://repository.ubn.ru.nl/handle/2066/132653,Quantitative analysis of stain variability in histology slides and an algorithm for standardization,https://doi.org/10.1117/12.2043683,Quantitative analysis of stain variability in histology slides and an algorithm for standardization,https://doi.org/10.1117/12.2043683,1.0,True,Quantitative analysis of stain variability in histology slides and an algorithm for standardization Ehteshami Bejnordi Timofeeva Otte-Höller Karssemeijer van der Laak
bejn15,https://repository.ubn.ru.nl/handle/2066/141326,A multi-scale superpixel classification approach to the detection of regions of interest in whole slide histopathology images,https://doi.org/10.1117/12.2081768,A multi-scale superpixel classification approach to the detection of regions of interest in whole slide histopathology images,https://doi.org/10.1117/12.2081768,1.0,True,A multi-scale superpixel classification approach to the detection of regions of interest in whole slide histopathology images Bejnordi Litjens Hermsen Karssemeijer Laak
bejn17b,https://repository.ubn.ru.nl/handle/2066/181885,Context-aware stacked convolutional neural networks for classification of breast carcinomas in whole-slide histopathology images,https://doi.org/10.1117/1.JMI.4.4.044504,Context-aware stacked convolutional neural networks for classification of breast carcinomas in whole-slide histopathology images,https://doi.org/10.1117/1.JMI.4.4.044504,1.0,True,Context-aware stacked convolutional neural networks for classification of breast carcinomas in whole-slide histopathology images Bejnordi Zuidhof Balkenhol Hermsen Bult Ginneken Karssemeijer Litjens Laak
bel21,https://repository.ubn.ru.nl/handle/2066/233603,Residual cyclegan for robust domain transformation of histopathological tissue slides.,https://doi.org/10.1016/j.media.2021.102004,Residual cyclegan for robust domain transformation of histopathological tissue slides,https://doi.org/10.1016/j.media.2021.102004,0.9941520467836257,True,Residual cyclegan for robust domain transformation of histopathological tissue slides. Bel Bokhorst Laak Litjens
bian18,https://repository.ubn.ru.nl/handle/2066/194505,Small airway segmentation in thoracic computed tomography scans: a machine learning approach,https://doi.org/10.1088/1361-6560/aad2a1,Small airway segmentation in thoracic computed tomography scans: a machine learning approach,https://doi.org/10.1088/1361-6560/aad2a1,1.0,True,Small airway segmentation in thoracic computed tomography scans a machine learning approach Bian Charbonnier Liu Zhao Lynch Ginneken
boer20,https://repository.ubn.ru.nl/handle/2066/217643,Interactive 3D U-net for the Segmentation of the Pancreas in Computed Tomography Scans,https://doi.org/10.1088/1361-6560/ab6f99,Interactive 3D U-net for the segmentation of the pancreas in computed tomography scans,https://doi.org/10.1088/1361-6560/ab6f99,1.0,True,Interactive 3D U-net for the Segmentation of the Pancreas in Computed Tomography Scans Boers Hu Gibson Barratt Bonmati Krdzalic Heijden Hermans Huisman
boo09,https://repository.ubn.ru.nl/handle/2066/81498,Computer-aided detection (CAD) of lung nodules and small tumours on chest radiographs,https://doi.org/10.1016/j.ejrad.2009.05.062,Computer-aided detection (CAD) of lung nodules and small tumours on chest radiographs.,https://doi.org/10.1016/j.ejrad.2009.05.062,0.9941520467836257,True,Computer-aided detection (CAD) of lung nodules and small tumours on chest radiographs Boo Prokop Uffmann Ginneken Schaefer-Prokop
boom14,https://repository.ubn.ru.nl/handle/2066/136581,A 4D Digital Phantom for Patient-Specific Simulation of Brain CT Perfusion Protocols,https://doi.org/10.1118/1.4881520,A 4D Digital Phantom for Patient-Specific Simulation of Brain CT Perfusion Protocols,https://doi.org/10.1118/1.4881520,1.0,True,A 4D Digital Phantom for Patient-Specific Simulation of Brain CT Perfusion Protocols Boom Manniesing Oei Woude Smit Laue Ginneken Prokop
boss01,https://repository.ubn.ru.nl/handle/2066/122189,Post-radiotherapy contrast enhancement changes in fast dynamic MRI of cervical carcinoma,https://doi.org/10.1002/jmri.1084,Post-radiotherapy contrast enhancement changes in fast dynamic MRI of cervical carcinoma.,https://doi.org/10.1002/jmri.1084,0.9943502824858758,True,Post-radiotherapy contrast enhancement changes in fast dynamic MRI of cervical carcinoma Boss Massuger Pop Verhoef Huisman Boonstra Barentsz
boue18,,Lobar Emphysema Distribution Is Associated With 5-Year Radiological Disease Progression,https://doi.org/10.1016/j.chest.2017.09.022,,,,False,Lobar Emphysema Distribution Is Associated With 5-Year Radiological Disease Progression Boueiz Chang Cho Washko Jose San  Estepar Bowler Crapo DeMeo Dy Silverman Castaldi COPDGene Investigators
bult19,https://repository.ubn.ru.nl/handle/2066/218800,Epithelium segmentation using deep learning in H&E-stained prostate specimens with immunohistochemistry as reference standard,https://doi.org/10.1038/s41598-018-37257-4,Assessment of individual tumor buds using keratin immunohistochemistry: moderate interobserver agreement suggests a role for machine learning,https://doi.org/10.1038/s41379-019-0434-2,0.39097744360902253,False,Epithelium segmentation using deep learning in H&E-stained prostate specimens with immunohistochemistry as reference standard Bulten Bándi Hoven van de Loo Lotz Weiss van der Laak van Ginneken Hulsbergen-van de Kaa Litjens
bult20,https://repository.ubn.ru.nl/handle/2066/217309,Automated deep-learning system for Gleason grading of prostate cancer using biopsies: a diagnostic study,https://doi.org/10.1016/S1470-2045(19)30739-9,Automated deep-learning system for Gleason grading of prostate cancer using biopsies: a diagnostic study,https://doi.org/10.1016/S1470-2045(19)30739-9,1.0,True,Automated deep-learning system for Gleason grading of prostate cancer using biopsies a diagnostic study Bulten Pinckaers Boven Vink Bel Ginneken Laak Hulsbergen-van  Kaa Litjens
char18,https://repository.ubn.ru.nl/handle/2066/183711,Automatic segmentation of the solid core and enclosed vessels in subsolid pulmonary nodules,https://doi.org/10.1038/s41598-017-19101-3,Automatic segmentation of the solid core and enclosed vessels in subsolid pulmonary nodules,https://doi.org/10.1038/s41598-017-19101-3,1.0,True,Automatic segmentation of the solid core and enclosed vessels in subsolid pulmonary nodules Charbonnier Chung Scholten Rikxoort Jacobs Sverzellati Silva Pastorino Ginneken Ciompi
char19,https://repository.ubn.ru.nl/handle/2066/201027,Airway wall thickening on CT: Relation to smoking status and severity of COPD,https://doi.org/10.1016/j.rmed.2018.11.014,Airway wall thickening on CT: Relation to smoking status and severity of COPD,https://doi.org/10.1016/j.rmed.2018.11.014,1.0,True,Airway wall thickening on CT Relation to smoking status and severity of COPD Charbonnier Pompe Moore Humphries Ginneken Make Regan Crapo Rikxoort Lynch
chun17,,Lung-RADS Category 4X: Does It Improve Prediction of Malignancy in Subsolid Nodules?,https://doi.org/10.1148/radiol.2017161624,,,,False,Lung-RADS Category 4X Does It Improve Prediction of Malignancy in Subsolid Nodules? Chung Jacobs Scholten Goo Prosch Sverzellati Ciompi Mets Gerke Prokop Ginneken Schaefer-Prokop
chun17a,https://repository.ubn.ru.nl/handle/2066/181940,Malignancy estimation of Lung-RADS criteria for subsolid nodules on CT: accuracy of low and high risk spectrum when using NLST nodules,https://doi.org/10.1007/s00330-017-4842-8,Malignancy estimation of Lung-RADS criteria for subsolid nodules on CT: accuracy of low and high risk spectrum when using NLST nodules,https://doi.org/10.1007/s00330-017-4842-8,1.0,True,Malignancy estimation of Lung-RADS criteria for subsolid nodules on CT accuracy of low and high risk spectrum when using NLST nodules Chung Jacobs Scholten Mets Dekker Prokop Ginneken Schaefer-Prokop
chun18,https://repository.ubn.ru.nl/handle/2066/189883,Visual Discrimination of Screen-detected Persistent from Transient Subsolid Nodules: an Observer Study,https://doi.org/10.1371/journal.pone.0191874,Visual discrimination of screen-detected persistent from transient subsolid nodules: An observer study,https://doi.org/10.1371/journal.pone.0191874,1.0,True,Visual Discrimination of Screen-detected Persistent from Transient Subsolid Nodules an Observer Study Chung Ciompi Scholten Prokop Jacobs Ginneken Schaefer-Prokop
chun18b,https://repository.ubn.ru.nl/handle/2066/191598,Brock malignancy risk calculator for pulmonary nodules: validation outside a lung cancer screening population,https://doi.org/10.1136/thoraxjnl-2017-211372,Malignancy risk estimation of subsolid nodules,,0.36129032258064514,False,Brock malignancy risk calculator for pulmonary nodules validation outside a lung cancer screening population Chung Mets Gerke Jacobs Harder Scholten Prokop Jong Ginneken Schaefer-Prokop
ciom14,https://repository.ubn.ru.nl/handle/2066/139326,ECOC-DRF: Discriminative Random Fields based on Error-Correcting Output Codes,https://doi.org/10.1016/j.patcog.2013.12.007,ECOC-DRF: Discriminative random fields based on error correcting output codes,https://doi.org/10.1016/j.patcog.2013.12.007,0.987012987012987,True,ECOC-DRF Discriminative Random Fields based on Error-Correcting Output Codes Ciompi Pujol Radeva
ciom15a,https://repository.ubn.ru.nl/handle/2066/154608,Automatic classification of pulmonary peri-fissural nodules in computed tomography using an ensemble of 2D views and a convolutional neural network out-of-the-box,https://doi.org/10.1016/j.media.2015.08.001,Automatic classification of pulmonary peri-fissural nodules in computed tomography using an ensemble of 2D views and a convolutional neural network out-of-the-box,https://doi.org/10.1016/j.media.2015.08.001,1.0,True,Automatic classification of pulmonary peri-fissural nodules in computed tomography using an ensemble of 2D views and a convolutional neural network out-of-the-box Ciompi Hoop Riel Chung Scholten Oudkerk Jong Prokop Ginneken
ciom17a,https://repository.ubn.ru.nl/handle/2066/174848,Towards automatic pulmonary nodule management in lung cancer screening with deep learning,https://doi.org/10.1038/srep46479,Towards automatic pulmonary nodule management in lung cancer screening with deep learning,https://doi.org/10.1038/srep46479,1.0,True,Towards automatic pulmonary nodule management in lung cancer screening with deep learning Ciompi Chung Riel Setio Gerke Jacobs Scholten Schaefer-Prokop Wille Marchiano Pastorino Prokop Ginneken
cohe16,https://repository.ubn.ru.nl/handle/2066/165779,Software performance in segmenting ground-glass and solid components of subsolid nodules in pulmonary adenocarcinomas,https://doi.org/10.1007/s00330-016-4317-3,Software performance in segmenting ground-glass and solid components of subsolid nodules in pulmonary adenocarcinomas,https://doi.org/10.1007/s00330-016-4317-3,1.0,True,Software performance in segmenting ground-glass and solid components of subsolid nodules in pulmonary adenocarcinomas Cohen Goo Yoo Park Lee van Ginneken Chung Kim
cohe16a,https://repository.ubn.ru.nl/handle/2066/171720,The effect of late-phase contrast enhancement on semi-automatic software measurements of CT attenuation and volume of part-solid nodules in lung adenocarcinomas,https://doi.org/10.1016/j.ejrad.2016.03.027,The effect of late-phase contrast enhancement on semi-automatic software measurements of CT attenuation and volume of part-solid nodules in lung adenocarcinomas,https://doi.org/10.1016/j.ejrad.2016.03.027,1.0,True,The effect of late-phase contrast enhancement on semi-automatic software measurements of CT attenuation and volume of part-solid nodules in lung adenocarcinomas Cohen Goo Yoo Park van Ginneken Ferretti Lee Park
cohe17,https://repository.ubn.ru.nl/handle/2066/178219,Comparison of the effects of model-based iterative reconstruction and filtered back projection algorithms on software measurements in pulmonary subsolid nodules,https://doi.org/10.1007/s00330-016-4716-5,Comparison of the effects of model-based iterative reconstruction and filtered back projection algorithms on software measurements in pulmonary subsolid nodules,https://doi.org/10.1007/s00330-016-4716-5,1.0,True,Comparison of the effects of model-based iterative reconstruction and filtered back projection algorithms on software measurements in pulmonary subsolid nodules Cohen Kim Park Ginneken Ferretti Lee Goo Park
dale04,https://repository.ubn.ru.nl/handle/2066/57635,Accuracy of rigid CT-FDG-PET image registration of the liver,https://doi.org/10.1088/0031-9155/49/23/014,Accuracy of rigid CT-FDG-PET image registration of the liver.,https://doi.org/10.1088/031-9155/49/23/014,0.9917355371900827,False,Accuracy of rigid CT-FDG-PET image registration of the liver Dalen Vogel Huisman Oyen Jager Karssemeijer
dalm17,https://repository.ubn.ru.nl/handle/2066/173062,Using deep learning to segment breast and fibroglandular tissue in MRI volumes,https://doi.org/10.1002/mp.12079,Using deep learning to segment breast and fibroglandular tissue in MRI volumes,https://doi.org/10.1002/mp.12079,1.0,True,Using deep learning to segment breast and fibroglandular tissue in MRI volumes Dalmis Litjens Holland Setio Mann Karssemeijer Gubern-Mérida
deba11,https://repository.ubn.ru.nl/handle/2066/96662,Automated 3-Dimensional Segmentation of Pelvic Lymph Nodes in Magnetic Resonance Images,https://doi.org/10.1118/1.3654162,Automated 3-dimensional segmentation of pelvic lymph nodes in magnetic resonance images,https://doi.org/10.1118/1.3654162,1.0,True,Automated 3-Dimensional Segmentation of Pelvic Lymph Nodes in Magnetic Resonance Images Debats Litjens Barentsz Karssemeijer Huisman
deba16,https://repository.ubn.ru.nl/handle/2066/171995,Automated multistructure atlas-assisted detection of lymph nodes using pelvic MR lymphography in prostate cancer patients,https://doi.org/10.1118/1.4951726,Automated multistructure atlas-assisted detection of lymph nodes using pelvic MR lymphography in prostate cancer patients,https://doi.org/10.1118/1.4951726,1.0,True,Automated multistructure atlas-assisted detection of lymph nodes using pelvic MR lymphography in prostate cancer patients Debats Meijs Litjens Huisman
deba16a,https://repository.ubn.ru.nl/handle/2066/165687,Intranodal signal suppression in pelvic MR lymphography of prostate cancer patients: a quantitative comparison of ferumoxtran-10 and ferumoxytol,https://doi.org/10.7717/peerj.2471,Intranodal signal suppression in pelvic MR lymphography of prostate cancer patients: a quantitative comparison of ferumoxtran-10 and ferumoxytol,https://doi.org/10.7717/peerj.2471,1.0,True,Intranodal signal suppression in pelvic MR lymphography of prostate cancer patients a quantitative comparison of ferumoxtran-10 and ferumoxytol Debats Fortuin Meijer Hambrock Litjens Barentsz Huisman
deba19,https://repository.ubn.ru.nl/handle/2066/215826,Lymph node detection in MR Lymphography: false positive reduction using multi-view convolutional neural networks,https://doi.org/10.7717/peerj.8052,Lymph node detection in MR Lymphography: false positive reduction using multi-view convolutional neural networks,https://doi.org/10.7717/peerj.8052,1.0,True,Lymph node detection in MR Lymphography false positive reduction using multi-view convolutional neural networks Debats Litjens Huisman
dekk21,,High Levels of Osteoprotegerin Are Associated with Coronary Artery Calcification in Patients Suspected of a Chronic Coronary Syndrome,https://doi.org/10.1038/s41598-021-98177-4,,,,False,High Levels of Osteoprotegerin Are Associated with Coronary Artery Calcification in Patients Suspected of a Chronic Coronary Syndrome Dekker Waissi Silvis Bennekom Schoneveld de Winter Isgum Lessmann Velthuis Pasterkamp Mosterd Timmers de Kleijn
deva17,https://repository.ubn.ru.nl/handle/2066/181824,Use of Volumetry for Lung Nodule Management: Theory and Practice,https://doi.org/10.1148/radiol.2017151022,Use of Volumetry for Lung Nodule Management: Theory and Practice,https://doi.org/10.1148/radiol.2017151022,1.0,True,Use of Volumetry for Lung Nodule Management Theory and Practice Devaraj Ginneken Nair Baldwin
dijk15,https://repository.ubn.ru.nl/handle/2066/153524,Novel Genes for Airway Wall Thickness Identified with Combined Genome Wide Association and Expression Analyses,https://doi.org/10.1164/rccm.201405-0840OC,Novel Genes for Airway Wall Thickness Identified with Combined Genome Wide Association and Expression Analyses,https://doi.org/10.1164/rccm.201405-0840OC,1.0,True,Novel Genes for Airway Wall Thickness Identified with Combined Genome Wide Association and Expression Analyses Dijkstra Postma Ginneken Wielpütz Schmidt Becker Owsijewitsch Kauczor Koning Lammers Oudkerk Brandsma Bossé Nickle Sin Hiemstra Wijmenga Smolonska Zanen Vonk Berge Boezen Groen
enge03a,https://repository.ubn.ru.nl/handle/2066/122329,Discrimination of prostate cancer from normal peripheral zone and central gland tissue by using dynamic contrast-enhanced MR imaging,https://doi.org/10.1148/radiol.2291020200,Discrimination of prostate cancer from normal peripheral zone and central gland tissue by using dynamic contrast-enhanced MR imaging.,https://doi.org/10.1148/radiol.2291020200,0.9962264150943396,True,Discrimination of prostate cancer from normal peripheral zone and central gland tissue by using dynamic contrast-enhanced MR imaging Engelbrecht Huisman Laheij Jager Leenders Hulsbergen-van  Kaa Rosette Blickman Barentsz
enge06a,https://repository.ubn.ru.nl/handle/2066/51174,Volumetric breast density estimation from full-field digital mammograms,https://doi.org/10.1109/TMI.2005.862741,Volumetric breast density estimation from full-field digital mammograms.,https://doi.org/10.1109/TMI.2005.862741,0.993006993006993,True,Volumetric breast density estimation from full-field digital mammograms Engeland Snoeren Huisman Boetes Karssemeijer
fens13,https://repository.ubn.ru.nl/handle/2066/140583,"Subphenotypes of Mild-to-Moderate COPD by Factor and Cluster Analysis of Pulmonary Function, CT Imaging and Breathomics in a Population-Based Survey",https://doi.org/10.3109/15412555.2012.744388,"Subphenotypes of Mild-to-Moderate COPD by Factor and Cluster Analysis of Pulmonary Function, CT Imaging and Breathomics in a Population-Based Survey",https://doi.org/10.3109/15412555.2012.744388,1.0,True,"Subphenotypes of Mild-to-Moderate COPD by Factor and Cluster Analysis of Pulmonary Function, CT Imaging and Breathomics in a Population-Based Survey Fens Rossum Zanen Ginneken Klaveren Zwinderman Sterk"
