bibkey,url,bib_title,bib_doi,match_title,match_doi,title_match_ratio,same_doi,search_string
jaco15,,"Solid, Part-Solid, or Non-solid?: Classification of Pulmonary Nodules in Low-Dose Chest Computed Tomography by a Computer-Aided Diagnosis System",https://doi.org/10.1097/RLI.0000000000000121,,,,False,"Solid, Part-Solid, or Non-solid? Classification of Pulmonary Nodules in Low-Dose Chest Computed Tomography by a Computer-Aided Diagnosis System Jacobs Rikxoort Scholten Jong Prokop Schaefer-Prokop Ginneken"
jaco19,https://repository.ubn.ru.nl/handle/2066/209067,Google's lung cancer AI: a promising tool that needs further validation,https://doi.org/10.1038/s41571-019-0248-7,Google's lung cancer AI: a promising tool that needs further validation,https://doi.org/10.1038/s41571-019-0248-7,1.0,True,Google's lung cancer AI a promising tool that needs further validation Jacobs Ginneken
jaco21,https://repository.ubn.ru.nl/handle/2066/231282,Assisted versus Manual Interpretation of Low-Dose CT Scans for Lung Cancer Screening: Impact on Lung-RADS Agreement,https://doi.org/10.1148/rycan.2021200160,Lung cancer screening: use the scan to decide who to scan when,,0.3389830508474576,False,Assisted versus Manual Interpretation of Low-Dose CT Scans for Lung Cancer Screening Impact on Lung-RADS Agreement Jacobs Schreuder Riel Scholten Wittenberg Winkler  Wille Hoop Sprengers Mets Geurts Prokop Schaefer-Prokop Ginneken
jaco21a,https://repository.ubn.ru.nl/handle/2066/245169,Deep Learning for Lung Cancer Detection in Screening CT Scans: Results of a Large-Scale Public Competition and an Observer Study with 11 Radiologists,https://doi.org/10.1148/ryai.2021210027,Deep Learning for Lung Cancer Detection on Screening CT Scans: Results of a Large-Scale Public Competition and an Observer Study with 11 Radiologists,https://doi.org/10.1148/ryai.2021210027,0.9932885906040269,True,Deep Learning for Lung Cancer Detection in Screening CT Scans Results of a Large-Scale Public Competition and an Observer Study with 11 Radiologists Jacobs Setio Scholten Gerke Bhattacharya M.  Hoesein Brink Ranschaert Jong Silva Geurts Chung Schalekamp Meersschaert Devaraj Pinsky Lam Ginneken Farahani
jara15,,Reduced Bone Density and Vertebral Fractures in Smokers. Men and COPD Patients at Increased Risk,https://doi.org/10.1513/AnnalsATS.201412-591OC,,,,False,Reduced Bone Density and Vertebral Fractures in Smokers. Men and COPD Patients at Increased Risk Jaramillo Wilson Stinson Stinson Lynch Bowler Lutz Bon Arnold McDonald Washko Wan DeMeo Foreman Soler Lindsay Lane Genant Silverman Hokanson Make Crapo Regan COPD Gene Investigators
kauc20,,ESR/ERS statement paper on lung cancer screening,https://doi.org/10.1007/s00330-020-06727-7,,,,False,ESR/ERS statement paper on lung cancer screening Kauczor Baird Blum Bonomo Bostantzoglou Burghuber Čepicka Comanescu Courad Devaraj Jespersen Morozov Agmon Peled Powell Prosch Ravara Rawlinson Revel Silca Snoeckx Ginneken Meerbeeck Vardavas Stackelberg Gaga (ESR) (ERS)
kobu16,https://repository.ubn.ru.nl/handle/2066/172209,Contribution of Histopathologic Tissue Composition to Quantitative MR Spectroscopy and Diffusion-weighted Imaging of the Prostate,https://doi.org/10.1148/radiol.2015142889,Contribution of Histopathologic Tissue Composition to Quantitative MR Spectroscopy and Diffusion-weighted Imaging of the Prostate,https://doi.org/10.1148/radiol.2015142889,1.0,True,Contribution of Histopathologic Tissue Composition to Quantitative MR Spectroscopy and Diffusion-weighted Imaging of the Prostate Kobus van der Laak Maas Hambrock Bruggink Hulsbergen-van de Kaa Scheenen Heerschap
kock14,https://repository.ubn.ru.nl/handle/2066/138328,Interactive lung segmentation in abnormal human and animal chest CT scans,https://doi.org/10.1118/1.4890597,Interactive lung segmentation in abnormal human and animal chest CT scans,https://doi.org/10.1118/1.4890597,1.0,True,Interactive lung segmentation in abnormal human and animal chest CT scans Kockelkorn Schaefer-Prokop Bozovic Muñoz-Barrutia Rikxoort Brown Jong Viergever Ginneken
kock16,https://repository.ubn.ru.nl/handle/2066/171478,Semi-automatic classification of textures in thoracic CT scans,https://doi.org/10.1088/0031-9155/61/16/5906,Semi-automatic classification of textures in thoracic CT scans,https://doi.org/10.1088/0031-9155/61/16/5906,1.0,True,Semi-automatic classification of textures in thoracic CT scans Kockelkorn de Jong Schaefer-Prokop Wittenberg Tiehuis Gietema Grutters Viergever van Ginneken
koes18,https://repository.ubn.ru.nl/handle/2066/194777,Computer-assisted chest radiography reading for tuberculosis screening in people living with diabetes mellitus,https://doi.org/10.5588/ijtld.17.0827,Computer-assisted chest radiography reading for tuberculosis screening in people living with diabetes mellitus,https://doi.org/10.5588/ijtld.17.0827,1.0,True,Computer-assisted chest radiography reading for tuberculosis screening in people living with diabetes mellitus Koesoemadinata Kranzer Livia Susilawati Annisa Soetedjo Ruslami Philipsen Ginneken Soetikno Crevel Alisjahbana Hill
kooi17,https://repository.ubn.ru.nl/handle/2066/173029,Large scale deep learning for computer aided detection of mammographic lesions,https://doi.org/10.1016/j.media.2016.07.007,Large scale deep learning for computer aided detection of mammographic lesions,https://doi.org/10.1016/j.media.2016.07.007,1.0,True,Large scale deep learning for computer aided detection of mammographic lesions Kooi Litjens Ginneken Gubern-Mérida Sánchez Mann Heeten Karssemeijer
kooi17c,https://repository.ubn.ru.nl/handle/2066/173098,Discriminating solitary cysts from soft tissue lesions in mammography using a pretrained deep convolutional neural network,https://doi.org/10.1002/mp.12110,Discriminating Solitary Cysts from Soft Tissue Lesions in Mammography using a Pretrained Deep Convolutional Neural Network,https://doi.org/10.1002/mp.12110,1.0,True,Discriminating solitary cysts from soft tissue lesions in mammography using a pretrained deep convolutional neural network Kooi Ginneken Karssemeijer Heeten
kos20,https://repository.ubn.ru.nl/handle/2066/220827,Pitfalls in assessing stromal tumor infiltrating lymphocytes (sTILs) in breast cancer,https://doi.org/10.1038/s41523-020-0156-0,Pitfalls in assessing stromal tumor infiltrating lymphocytes (sTILs) in breast cancer,https://doi.org/10.1038/s41523-020-0156-0,1.0,True,Pitfalls in assessing stromal tumor infiltrating lymphocytes (sTILs) in breast cancer Kos Roblin Kim Michiels Gallas Chen Vijver Goel Adams Demaria Viale Nielsen Badve Symmans Sotiriou Rimm Hewitt Denkert Loibl Luen Bartlett Savas Pruneri Dillon Cheang Tutt Hall Kok Horlings Madabhushi Laak Ciompi Laenkholm Bellolio Gruosso Fox Araya Floris Hudeček Voorwerk Beck Kerner Larsimont Declercq Eynden Pusztai Ehinger Yang AbdulJabbar Yuan Singh Hiley Bakir Lazar Naber Wienert Castillo Curigliano Dieci André Swanton Reis-Filho Sparano Balslev Chen Stovgaard Pogue-Geile Blenman Penault-Llorca Schnitt Lakhani Vincent-Salomon Rojo Braybrooke Hanna Soler-Monsó Bethmann Castaneda Willard-Gallo Sharma Lien Fineberg Thagaard Comerma Gonzalez-Ericsson Brogi Loi Saltz Klaushen Cooper Amgad Moore Salgado
kox11,https://repository.ubn.ru.nl/handle/2066/98553,a7 Nicotinic acetylcholine receptor agonist GTS-21 attenuates ventilator-induced tumour necrosis factor-a production and lung injury,https://doi.org/10.1093/bja/aer202,alpha7 Nicotinic acetylcholine receptor agonist GTS-21 attenuates ventilator-induced tumour necrosis factor-alpha production and lung injury,https://doi.org/10.1093/bja/aer202,0.9705882352941176,True,a7 Nicotinic acetylcholine receptor agonist GTS-21 attenuates ventilator-induced tumour necrosis factor-a production and lung injury Kox Pompe Peters M. Laak Hoeven Scheffer Hoedemaekers Pickkers
laak00,https://repository.ubn.ru.nl/handle/2066/144809,Hue-saturation-density (HSD) model for stain recognition in digital images from transmitted light microscopy,,Hue-saturation-density (HSD) model for stain recognition in digital images from transmitted light microscopy,,1.0,False,Hue-saturation-density (HSD) model for stain recognition in digital images from transmitted light microscopy Laak Pahlplatz Hanselaar Wilde
laak19,https://repository.ubn.ru.nl/handle/2066/215679,No pixel-level annotations needed,https://doi.org/10.1038/s41551-019-0472-6,No pixel-level annotations needed,https://doi.org/10.1038/s41551-019-0472-6,1.0,True,No pixel-level annotations needed Laak Ciompi Litjens
laak21,https://repository.ubn.ru.nl/handle/2066/235736,Deep learning in histopathology: the path to the clinic.,https://doi.org/10.1038/s41591-021-01343-4,Deep learning in histopathology: the path to the clinic,https://doi.org/10.1038/s41591-021-01343-4,0.990990990990991,True,Deep learning in histopathology the path to the clinic. Laak Litjens Ciompi
lass15,https://repository.ubn.ru.nl/handle/2066/153905,Robust semi-automatic segmentation of pulmonary subsolid nodules in chest computed tomography scans,https://doi.org/10.1088/0031-9155/60/3/1307,Robust semi-automatic segmentation of pulmonary subsolid nodules in chest computed tomography scans,https://doi.org/10.1088/0031-9155/60/3/1307,1.0,True,Robust semi-automatic segmentation of pulmonary subsolid nodules in chest computed tomography scans Lassen Jacobs Kuhnigk Ginneken Rikxoort
lass17,https://repository.ubn.ru.nl/handle/2066/181908,Fast interactive segmentation of the pulmonary lobes from thoracic computed tomography data,https://doi.org/10.1088/1361-6560/aa7674,Fast interactive segmentation of the pulmonary lobes from thoracic computed tomography data,https://doi.org/10.1088/1361-6560/aa7674,1.0,True,Fast interactive segmentation of the pulmonary lobes from thoracic computed tomography data Lassen-Schmidt Kuhnigk Konrad Ginneken Rikxoort
leac12,https://repository.ubn.ru.nl/handle/2066/108222,Imaging vascular function for early stage clinical trials using dynamic contrast-enhanced magnetic resonance imaging,,Imaging vascular function for early stage clinical trials using dynamic contrast-enhanced magnetic resonance imaging.,https://doi.org/10.1007/s00330-012-2446-x,0.9957081545064378,False,Imaging vascular function for early stage clinical trials using dynamic contrast-enhanced magnetic resonance imaging Leach Morgan Tofts Buckley Huang Horsfield Chenevert Collins Jackson Lomas Whitcher Clarke Plummer Judson Jones Alonzi Brunner Koh Murphy Waterton Parker Graves Scheenen Redpath Orton Karczmar Huisman Barentsz Padhani Committee
leem20,https://repository.ubn.ru.nl/handle/2066/218599,Stacked Bidirectional Convolutional LSTMs for Deriving 3D Non-contrast CT from Spatiotemporal 4D CT,https://doi.org/10.1109/TMI.2019.2939044,Stacked Bidirectional Convolutional LSTMs for Deriving 3D Non-Contrast CT From Spatiotemporal 4D CT,https://doi.org/10.1109/TMI.2019.2939044,1.0,True,Stacked Bidirectional Convolutional LSTMs for Deriving 3D Non-contrast CT from Spatiotemporal 4D CT van de Leemput Prokop van Ginneken Manniesing
leen20,,The 2019 International Society of Urological Pathology (ISUP) Consensus Conference on Grading of Prostatic Carcinoma.,https://doi.org/10.1097/PAS.0000000000001497,,,,False,The 2019 International Society of Urological Pathology (ISUP) Consensus Conference on Grading of Prostatic Carcinoma. Leenders Kwast Grignon Evans Kristiansen Kweldam Litjens McKenney Melamed Mottet Paner Samaratunga Schoots Simko Tsuzuki Varma Warren Wheeler Williamson Iczkowski Members
less19,https://repository.ubn.ru.nl/handle/2066/208061,Sex Differences in Coronary Artery and Thoracic Aorta Calcification and Their Association With Cardiovascular Mortality in Heavy Smokers,https://doi.org/10.1016/j.jcmg.2018.10.026,Sex Differences in Coronary Artery and Thoracic Aorta Calcification and Their Association With Cardiovascular Mortality in Heavy Smokers,https://doi.org/10.1016/j.jcmg.2018.https://doi.org/10.026,1.0,False,Sex Differences in Coronary Artery and Thoracic Aorta Calcification and Their Association With Cardiovascular Mortality in Heavy Smokers Lessmann Jong Celeng Takx Viergever Ginneken Išgum
less19a,https://repository.ubn.ru.nl/handle/2066/202066,Iterative fully convolutional neural networks for automatic vertebra segmentation and identification,https://doi.org/10.1016/j.media.2019.02.005,Iterative fully convolutional neural networks for automatic vertebra segmentation and identification,https://doi.org/10.1016/j.media.2019.02.005,1.0,True,Iterative fully convolutional neural networks for automatic vertebra segmentation and identification Lessmann Ginneken Jong Išgum
litj12a,https://repository.ubn.ru.nl/handle/2066/111051,A pattern recognition approach to zonal segmentation of the prostate on MRI,https://doi.org/10.1007/978-3-642-33418-4_51,A pattern recognition approach to zonal segmentation of the prostate on MRI,,1.0,False,A pattern recognition approach to zonal segmentation of the prostate on MRI Litjens Debats Ven Karssemeijer Huisman
litj12b,https://repository.ubn.ru.nl/handle/2066/108408,Interpatient Variation in Normal Peripheral Zone Apparent Diffusion Coefficient: Effect on the Prediction of Prostate Cancer Aggressiveness,https://doi.org/10.1148/radiol.12112374,Interpatient variation in normal peripheral zone apparent diffusion coefficient: effect on the prediction of prostate cancer aggressiveness,https://doi.org/10.1148/radiol.12112374,1.0,True,Interpatient Variation in Normal Peripheral Zone Apparent Diffusion Coefficient Effect on the Prediction of Prostate Cancer Aggressiveness Litjens Hambrock Hulsbergen-van  Kaa Barentsz Huisman
litj14,https://repository.ubn.ru.nl/handle/2066/137969,Evaluation of prostate segmentation algorithms for MRI: The PROMISE12 challenge,https://doi.org/10.1016/j.media.2013.12.002,Evaluation of prostate segmentation algorithms for MRI: The PROMISE12 challenge,https://doi.org/10.1016/j.media.2013.12.002,1.0,True,Evaluation of prostate segmentation algorithms for MRI The PROMISE12 challenge Litjens Toth Ven Hoeks Kerkstra Ginneken Vincent Guillard Birbeck Zhang Strand Malmberg Ou Davatzikos Kirschner Jung Yuan Qiu Gao Edwards Maan Heijden Ghose Mitra Dowling Barratt Huisman Madabhushi
litj14c,https://repository.ubn.ru.nl/handle/2066/127982,Computer-aided detection of prostate cancer in MRI,https://doi.org/10.1109/TMI.2014.2303821,Computer-Aided Detection of Prostate Cancer in MRI,https://doi.org/10.1109/TMI.2014.2303821,1.0,True,Computer-aided detection of prostate cancer in MRI Litjens Debats Barentsz Karssemeijer Huisman
litj14d,https://repository.ubn.ru.nl/handle/2066/173248,Quantitative identification of magnetic resonance imaging features of prostate cancer response following laser ablation and radical prostatectomy,https://doi.org/10.1117/1.JMI.1.3.035001,MRI-guided focal therapy in patients with localized (recurrent) prostate cancer,,0.32142857142857145,False,Quantitative identification of magnetic resonance imaging features of prostate cancer response following laser ablation and radical prostatectomy Litjens Huisman Elliott Shih Feldman Viswanath Fütterer Bomers Madabhushi
litj15b,https://repository.ubn.ru.nl/handle/2066/151185,Clinical evaluation of a computer-aided diagnosis system for determining cancer aggressiveness in prostate MRI,https://doi.org/10.1007/s00330-015-3743-y,Clinical evaluation of a computer-aided diagnosis system for determining cancer aggressiveness in prostate MRI,https://doi.org/10.1007/s00330-015-3743-y,1.0,True,Clinical evaluation of a computer-aided diagnosis system for determining cancer aggressiveness in prostate MRI Litjens Barentsz Karssemeijer Huisman
litj17,https://repository.ubn.ru.nl/handle/2066/179538,A Survey on Deep Learning in Medical Image Analysis,https://doi.org/10.1016/j.media.2017.07.005,A survey on deep learning in medical image analysis,https://doi.org/10.1016/j.media.2017.07.005,1.0,True,A Survey on Deep Learning in Medical Image Analysis Litjens Kooi Ehteshami  Bejnordi Setio Ciompi Ghafoorian Laak Ginneken Sánchez
litj18,https://repository.ubn.ru.nl/handle/2066/241323,1399 H&E-stained sentinel lymph node sections of breast cancer patients: the CAMELYON dataset,https://doi.org/10.1093/gigascience/giy065,Mechanistic models for the prediction of brain drug exposure and response in the pediatric population. A virtual child reaching maturation,,0.39826839826839827,False,1399 H&E-stained sentinel lymph node sections of breast cancer patients the CAMELYON dataset Litjens Bandi Ehteshami  Bejnordi Geessink Balkenhol Bult Halilovic Hermsen Loo Vogels Manson Stathonikos Baidoshvili Diest Wauters Dijk Laak
litj19,https://repository.ubn.ru.nl/handle/2066/208418,State-of-the-Art Deep Learning in Cardiovascular Image Analysis,https://doi.org/10.1016/j.jcmg.2019.06.009,State-of-the-Art Deep Learning in Cardiovascular Image Analysis,https://doi.org/10.1016/j.jcmg.2019.06.009,1.0,True,State-of-the-Art Deep Learning in Cardiovascular Image Analysis Litjens Ciompi Wolterink Vos Leiner Teuwen Isgum
lo12,https://repository.ubn.ru.nl/handle/2066/107854,Extraction of Airways from CT (EXACT'09),https://doi.org/10.1109/TMI.2012.2209674,Extraction of Airways from CT (EXACT'09),https://doi.org/10.1109/TMI.2012.2209674,1.0,True,Extraction of Airways from CT (EXACT'09) Lo Ginneken Reinhardt Tarunashree Jong Irving Fetita Ortner Pinho Sijbers Feuerstein Fabijanska Bauer Beichel Mendoza Wiemker Lee Reeves Born Weinheimer Rikxoort Tschirren Mori Odry Naidich Hartmann Hoffman Prokop Pedersen Bruijne
maas19,,"A Single-Arm, Multicenter Validation Study of Prostate Cancer Localization and Aggressiveness With a Quantitative Multiparametric Magnetic Resonance Imaging Approach",https://doi.org/10.1097/RLI.0000000000000558,,,,False,"A Single-Arm, Multicenter Validation Study of Prostate Cancer Localization and Aggressiveness With a Quantitative Multiparametric Magnetic Resonance Imaging Approach Maas Litjens Wright Attenberger Haider Helbich Kiefer Macura Margolis Padhani Selnaes Villeirs Futterer Scheenen"
madu13c,https://repository.ubn.ru.nl/handle/2066/125314,Detection of tuberculosis with digital chest radiography: automatic reading versus interpretation by clinical officers,https://doi.org/10.5588/ijtld.13.0325,Detection of tuberculosis with digital chest radiography: automatic reading versus interpretation by clinical officers,https://doi.org/10.5588/ijtld.13.0325,1.0,True,Detection of tuberculosis with digital chest radiography automatic reading versus interpretation by clinical officers Maduskar Muyoyeta Ayles Hogeweg Peters-Bax Ginneken
madu14,https://repository.ubn.ru.nl/handle/2066/137611,Cavity contour segmentation in chest radiographs using supervised learning and dynamic programming,https://doi.org/10.1118/1.4881096,Cavity contour segmentation in chest radiographs using supervised learning and dynamic programming,https://doi.org/10.1118/1.4881096,1.0,True,Cavity contour segmentation in chest radiographs using supervised learning and dynamic programming Maduskar Hogeweg Jong Peters-Bax Dawson Ayles Sánchez Ginneken
madu16,https://repository.ubn.ru.nl/handle/2066/168319,Automatic detection of pleural effusion in chest radiographs,https://doi.org/10.1016/j.media.2015.09.004,Automatic detection of pleural effusion in chest radiographs,https://doi.org/10.1016/j.media.2015.09.004,1.0,True,Automatic detection of pleural effusion in chest radiographs Maduskar Philipsen Melendez Scholten Chanda Ayles Sánchez van Ginneken
maho20,https://repository.ubn.ru.nl/handle/2066/217776,Computer-aided diagnosis for World Health Organization-defined chest radiograph primary-endpoint pneumonia in children,https://doi.org/10.1007/s00247-019-04593-0,Computer-aided diagnosis for World Health Organization-defined chest radiograph primary-endpoint pneumonia in children,https://doi.org/10.1007/s00247-019-04593-0,1.0,True,Computer-aided diagnosis for World Health Organization-defined chest radiograph primary-endpoint pneumonia in children Mahomed Ginneken Philipsen Melendez Moore Moodley Sewchuran Mathew Madhi
mann11,https://repository.ubn.ru.nl/handle/2066/97748,Comparison of enhancement characteristics between invasive lobular carcinoma and invasive ductal carcinoma,https://doi.org/10.1002/jmri.22632,Comparison of enhancement characteristics between invasive lobular carcinoma and invasive ductal carcinoma.,https://doi.org/10.1002/jmri.22632,0.9953051643192489,True,Comparison of enhancement characteristics between invasive lobular carcinoma and invasive ductal carcinoma Mann Veltman Huisman Boetes
mann16,https://repository.ubn.ru.nl/handle/2066/171318,Quantitative Dose Dependency Analysis of Whole-Brain CT Perfusion Imaging,https://doi.org/10.1148/radiol.2015142230,Quantitative Dose Dependency Analysis of Whole-Brain CT Perfusion Imaging,https://doi.org/10.1148/radiol.2015142230,1.0,True,Quantitative Dose Dependency Analysis of Whole-Brain CT Perfusion Imaging Manniesing Oei van Ginneken Prokop
melb11,https://repository.ubn.ru.nl/handle/2066/96425,The effect of motion correction on pharmacokinetic parameter estimation in dynamic-contrast-enhanced MRI,https://doi.org/10.1088/0031-9155/56/24/001,The effect of motion correction on pharmacokinetic parameter estimation in dynamic-contrast-enhanced MRI.,https://doi.org/10.1088/0031-9155/56/24/001,0.9952153110047847,True,The effect of motion correction on pharmacokinetic parameter estimation in dynamic-contrast-enhanced MRI Melbourne Hipwell Modat Mertzanidou Huisman Ourselin Hawkes
mele14b,https://repository.ubn.ru.nl/handle/2066/132831,Improving mass candidate detection in mammograms via feature maxima propagation and local feature selection,https://doi.org/10.1118/1.4885995,Improving mass candidate detection in mammograms via feature maxima propagation and local feature selection,https://doi.org/10.1118/1.4885995,1.0,True,Improving mass candidate detection in mammograms via feature maxima propagation and local feature selection Melendez Sánchez Ginneken Karssemeijer
mele17,https://repository.ubn.ru.nl/handle/2066/181866,Automatic versus human reading of chest X-rays in the Zambia National Tuberculosis Prevalence Survey,https://doi.org/10.5588/ijtld.16.0851,Automatic versus human reading of chest X-rays in the Zambia National Tuberculosis Prevalence Survey,https://doi.org/10.5588/ijtld.16.0851,1.0,True,Automatic versus human reading of chest X-rays in the Zambia National Tuberculosis Prevalence Survey Melendez Philipsen Chanda-Kapata Sunkutu Kapata Ginneken
mend09a,https://repository.ubn.ru.nl/handle/2066/81291,Noise reduction in computed tomography scans using 3-d anisotropic hybrid diffusion with continuous switch,https://doi.org/10.1109/TMI.2009.2022368,Noise reduction in computed tomography scans using 3-d anisotropic hybrid diffusion with continuous switch.,https://doi.org/10.1109/TMI.2009.2022368,0.9953051643192489,True,Noise reduction in computed tomography scans using 3-d anisotropic hybrid diffusion with continuous switch Mendrik Vonken Rutten Viergever Ginneken
mend10a,https://repository.ubn.ru.nl/handle/2066/88438,Automatic segmentation of intracranial arteries and veins in four-dimensional cerebral CT perfusion scans,https://doi.org/10.1118/1.3397813,Automatic segmentation of intracranial arteries and veins in four-dimensional cerebral CT perfusion scans.,https://doi.org/10.1118/1.3397813,0.995260663507109,True,Automatic segmentation of intracranial arteries and veins in four-dimensional cerebral CT perfusion scans Mendrik Vonken Ginneken Smit Waaijer Bertolini Viergever Prokop
mend11,https://repository.ubn.ru.nl/handle/2066/98391,TIPS bilateral noise reduction in 4D CT perfusion scans produces high-quality cerebral blood flow maps,https://doi.org/10.1088/0031-9155/56/13/008,TIPS bilateral noise reduction in 4D CT perfusion scans produces high-quality cerebral blood flow maps,https://doi.org/10.1088/0031-9155/56/13/008,1.0,True,TIPS bilateral noise reduction in 4D CT perfusion scans produces high-quality cerebral blood flow maps Mendrik Vonken Ginneken Jong Riordan Seeters Smit Viergever Prokop
mend12,https://repository.ubn.ru.nl/handle/2066/108266,Improved Arterial Visualization in Cerebral CT Perfusion-Derived Arteriograms Compared with Standard CT Angiography: A Visual Assessment Study,https://doi.org/10.3174/ajnr.A3118,Improved Arterial Visualization in Cerebral CT Perfusion-Derived Arteriograms Compared with Standard CT Angiography: A Visual Assessment Study,https://doi.org/10.3174/ajnr.A3118,1.0,True,Improved Arterial Visualization in Cerebral CT Perfusion-Derived Arteriograms Compared with Standard CT Angiography A Visual Assessment Study Mendrik Vonken Kort Ginneken Smit Viergever Prokop
mert12,https://repository.ubn.ru.nl/handle/2066/108597,MRI to X-ray mammography registration using a volume-preserving affine transformation,https://doi.org/10.1016/j.media.2012.03.001,MRI to X-ray mammography registration using a volume-preserving affine transformation.,https://doi.org/10.1016/j.media.2012.03.001,0.9941520467836257,True,MRI to X-ray mammography registration using a volume-preserving affine transformation Mertzanidou Hipwell Cardoso Zhang Tanner Ourselin Bick Huisman Karssemeijer Hawkes
mert17,https://repository.ubn.ru.nl/handle/2066/170535,3D volume reconstruction from serial breast specimen radiographs for mapping between histology and 3D whole specimen imaging,https://doi.org/10.1002/mp.12077,3D volume reconstruction from serial breast specimen radiographs for mapping between histology and 3D whole specimen imaging,https://doi.org/10.1002/mp.12077,1.0,True,3D volume reconstruction from serial breast specimen radiographs for mapping between histology and 3D whole specimen imaging Mertzanidou Hipwell Reis Hawkes Bejnordi Dalmis Vreemann Platel Laak Karssemeijer Hermsen Bult Mann
