bibkey,url,bib_title,bib_doi,match_title,match_doi,title_match_ratio,same_doi,search_string
mets18a,https://repository.ubn.ru.nl/handle/2066/191051,In vivo growth of 60 non-screening detected lung cancers: a computed tomography study,https://doi.org/10.1183/13993003.02183-2017,In vivo growth of 60 non-screening detected lung cancers: a computed tomography study,https://doi.org/10.1183/13993003.02183-2017,1.0,True,In vivo growth of 60 non-screening detected lung cancers a computed tomography study Mets Chung Zanen Scholten Veldhuis Ginneken Prokop Schaefer-Prokop Jong
muen12a,https://repository.ubn.ru.nl/handle/2066/109635,Supervised Quality Assessment Of Medical Image Registration: Application to intra-patient CT lung registration,https://doi.org/10.1016/j.media.2012.06.010,Supervised Quality Assessment Of Medical Image Registration: Application to intra-patient CT lung registration,https://doi.org/10.1016/j.media.2012.06.010,1.0,True,Supervised Quality Assessment Of Medical Image Registration Application to intra-patient CT lung registration Muenzing Ginneken Murphy Pluim
muen14,https://repository.ubn.ru.nl/handle/2066/137731,DIRBoost-An algorithm for boosting deformable image registration: Application to lung CT intra-subject registration,https://doi.org/10.1016/j.media.2013.12.006,DIRBoost-An algorithm for boosting deformable image registration: Application to lung CT intra-subject registration,https://doi.org/10.1016/j.media.2013.12.006,1.0,True,DIRBoost-An algorithm for boosting deformable image registration Application to lung CT intra-subject registration Muenzing Ginneken Viergever Pluim
mull19,https://repository.ubn.ru.nl/handle/2066/212635,Application of convolutional neural networks to breast biopsies to delineate tissue correlates of mammographic breast density,https://doi.org/10.1038/s41523-019-0134-6,Application of convolutional neural networks to breast biopsies to delineate tissue correlates of mammographic breast density,https://doi.org/10.1038/s41523-019-0134-6,1.0,True,Application of convolutional neural networks to breast biopsies to delineate tissue correlates of mammographic breast density Mullooly Ehteshami  Bejnordi Pfeiffer Fan Palakal Hada Vacek Weaver Shepherd Fan Mahmoudzadeh Wang Malkov Johnson Herschorn Sprague Hewitt Brinton Karssemeijer Laak Beck Sherman Gierach
murp09,https://repository.ubn.ru.nl/handle/2066/81262,A Large Scale Evaluation of Automatic Pulmonary Nodule Detection in Chest CT using Local Image Features and k-Nearest-Neighbour Classification,https://doi.org/10.1016/j.media.2009.07.001,A large-scale evaluation of automatic pulmonary nodule detection in chest CT using local image features and k-nearest-neighbour classification.,https://doi.org/10.1016/j.media.2009.07.001,0.9894736842105263,True,A Large Scale Evaluation of Automatic Pulmonary Nodule Detection in Chest CT using Local Image Features and k-Nearest-Neighbour Classification Murphy Ginneken Schilham Hoop Gietema Prokop
murp11a,https://repository.ubn.ru.nl/handle/2066/96888,Evaluation of Registration Methods on Thoracic CT: The EMPIRE10 Challenge,https://doi.org/10.1109/TMI.2011.2158349,Evaluation of Registration Methods on Thoracic CT: The EMPIRE10 Challenge,https://doi.org/10.1109/TMI.2011.2158349,1.0,True,Evaluation of Registration Methods on Thoracic CT The EMPIRE10 Challenge Murphy Ginneken Reinhardt Kabus Ding Deng Cao Du Christensen Garcia Vercauteren Ayache Commowick Malandain Glocker Paragios Navab Gorbunova Sporring Bruijne Han Heinrich Schnabel Jenkinson Lorenz Modat McClelland Ourselin Muenzing Viergever Nigris Collins Arbel Peroni Li Sharp Schmidt-Richberg Ehrhardt Werner Smeets Loeckx Song Tustison Avants Gee Staring Klein Stoel Urschler Werlberger Vandemeulebroucke Rit Sarrut Pluim
murp12,https://repository.ubn.ru.nl/handle/2066/110012,Toward automatic regional analysis of pulmonary function using inspiration and expiration thoracic CT,https://doi.org/10.1118/1.3687891,Toward automatic regional analysis of pulmonary function using inspiration and expiration thoracic CT.,https://doi.org/10.1118/1.3687891,0.9950738916256158,True,Toward automatic regional analysis of pulmonary function using inspiration and expiration thoracic CT Murphy Pluim Rikxoort Jong Hoop Gietema Mets Bruijne Lo Prokop Ginneken
nage13,https://repository.ubn.ru.nl/handle/2066/118297,Differentiation of Prostatitis and Prostate Cancer by Using Diffusion-weighted MR Imaging and MR-guided Biopsy at 3 T,https://doi.org/10.1148/radiol.12111683,Differentiation of Prostatitis and Prostate Cancer by Using Diffusion-weighted MR Imaging and MR-guided Biopsy at 3 T,https://doi.org/10.1148/radiol.12111683,1.0,True,Differentiation of Prostatitis and Prostate Cancer by Using Diffusion-weighted MR Imaging and MR-guided Biopsy at 3 T Nagel Schouten Hambrock Litjens Hoeks Haken Barentsz Fütterer
niek09,https://repository.ubn.ru.nl/handle/2066/81446,Computerized whole slide quantification shows increased microvascular density in pT2 prostate cancer as compared to normal prostate tissue,https://doi.org/10.1002/pros.20855,Computerized whole slide quantification shows increased microvascular density in pT2 prostate cancer as compared to normal prostate tissue.,https://doi.org/10.1002/pros.20855,0.9963898916967509,True,Computerized whole slide quantification shows increased microvascular density in pT2 prostate cancer as compared to normal prostate tissue Niekerk Laak Börger Huisman Witjes Barentsz Hulsbergen-van  Kaa
niem09,https://repository.ubn.ru.nl/handle/2066/80726,Fast detection of the optic disc and fovea in color fundus photographs,https://doi.org/10.1016/j.media.2009.08.003,Fast detection of the optic disc and fovea in color fundus photographs.,https://doi.org/10.1016/j.media.2009.08.003,0.9929078014184397,True,Fast detection of the optic disc and fovea in color fundus photographs Niemeijer Abràmoff Ginneken
niem10,https://repository.ubn.ru.nl/handle/2066/89373,Retinopathy online challenge: automatic detection of microaneurysms in digital color fundus photographs,https://doi.org/10.1109/TMI.2009.2033909,Retinopathy online challenge: automatic detection of microaneurysms in digital color fundus photographs.,https://doi.org/10.1109/TMI.2009.2033909,0.9951690821256038,True,Retinopathy online challenge automatic detection of microaneurysms in digital color fundus photographs Niemeijer Ginneken Cree Mizutani Quellec Sánchez Zhang Hornero Lamard Muramatsu Wu Cazuguel You Mayo Li Hatanaka Cochener Roux Karray Garcia Fujita Abràmoff
niem11b,https://repository.ubn.ru.nl/handle/2066/97661,Automated measurement of the arteriolar-to-venular width ratio in digital color fundus photographs,https://doi.org/10.1109/TMI.2011.2159619,Automated Measurement of the Arteriolar-to-Venular Width Ratio in Digital Color Fundus Photographs,https://doi.org/10.1109/TMI.2011.2159619,1.0,True,Automated measurement of the arteriolar-to-venular width ratio in digital color fundus photographs Niemeijer Xu Dumitrescu Gupta Ginneken Folk Abràmoff
nill07,https://repository.ubn.ru.nl/handle/2066/52135,Segmentation of the heart muscle in 3-D pediatric echocardiographic images,https://doi.org/10.1016/j.ultrasmedbio.2007.04.001,Segmentation of the heart muscle in 3-D pediatric echocardiographic images.,https://doi.org/10.1016/j.ultrasmedbio.2007.04.001,0.9932885906040269,True,Segmentation of the heart muscle in 3-D pediatric echocardiographic images Nillesen Lopata Gerrits Kapusta Huisman Thijssen Korte
nill09,https://repository.ubn.ru.nl/handle/2066/80272,In vivo validation of cardiac output assessment in non-standard 3D echocardiographic images,https://doi.org/10.1088/0031-9155/54/7/006,In vivo validation of cardiac output assessment in non-standard 3D echocardiographic images.,https://doi.org/10.1088/0031-9155/54/7/006,0.994535519125683,True,In vivo validation of cardiac output assessment in non-standard 3D echocardiographic images Nillesen Lopata Boode Gerrits Huisman Thijssen Kapusta Korte
nill11,https://repository.ubn.ru.nl/handle/2066/95767,Correlation based 3-D segmentation of the left ventricle in pediatric echocardiographic images using radio-frequency data,https://doi.org/10.1016/j.ultrasmedbio.2011.05.005,Correlation based 3-D segmentation of the left ventricle in pediatric echocardiographic images using radio-frequency data,https://doi.org/10.1016/j.ultrasmedbio.2011.05.005,1.0,True,Correlation based 3-D segmentation of the left ventricle in pediatric echocardiographic images using radio-frequency data Nillesen Lopata Huisman Thijssen Kapusta Korte
pate17b,https://repository.ubn.ru.nl/handle/2066/170408,Robust Cranial Cavity Segmentation in CT and CT Perfusion Images of Trauma and Suspected Stroke Patients,https://doi.org/10.1016/j.media.2016.12.002,Robust cranial cavity segmentation in CT and CT perfusion images of trauma and suspected stroke patients,https://doi.org/10.1016/j.media.2016.12.002,1.0,True,Robust Cranial Cavity Segmentation in CT and CT Perfusion Images of Trauma and Suspected Stroke Patients Patel Ginneken Meijer Dijk Prokop Manniesing
phil15,https://repository.ubn.ru.nl/handle/2066/153295,Localized energy-based normalization of medical images: application to chest radiography,https://doi.org/10.1109/TMI.2015.2418031,Localized energy-based normalization of medical images: application to chest radiography,https://doi.org/10.1109/TMI.2015.2418031,1.0,True,Localized energy-based normalization of medical images application to chest radiography Philipsen Maduskar Hogeweg Melendez Sánchez Ginneken
phil19a,https://repository.ubn.ru.nl/handle/2066/207373,Automated chest X-ray reading for tuberculosis in the Philippines to improve case detection: a cohort study,https://doi.org/10.5588/ijtld.18.0004,Automated chest X-ray reading for tuberculosis in the Philippines to improve case detection: a cohort study,https://doi.org/10.5588/ijtld.18.0004,1.0,True,Automated chest X-ray reading for tuberculosis in the Philippines to improve case detection a cohort study Philipsen Sánchez Melendez Lew Ginneken
pinc21,https://repository.ubn.ru.nl/handle/2066/235135,Detection of prostate cancer in whole-slide images through end-to-end training with image-level labels.,https://doi.org/10.1109/TMI.2021.3066295,Detection of Prostate Cancer in Whole-Slide Images Through End-to-End Training With Image-Level Labels,https://doi.org/10.1109/TMI.2021.3066295,0.9951219512195122,True,Detection of prostate cancer in whole-slide images through end-to-end training with image-level labels. Pinckaers Bulten Van  Laak Litjens
pomp15,https://repository.ubn.ru.nl/handle/2066/153586,Parametric response mapping adds value to current computed tomography biomarkers in diagnosing chronic obstructive pulmonary disease,https://doi.org/10.1164/rccm.201411-2105LE,Parametric response mapping adds value to current computed tomography biomarkers in diagnosing chronic obstructive pulmonary disease,https://doi.org/10.1164/rccm.201411-2105LE,1.0,True,Parametric response mapping adds value to current computed tomography biomarkers in diagnosing chronic obstructive pulmonary disease Pompe Rikxoort Schmidt Rühaak Gallardo-Estrella Vliegenthart Oudkerk Koning Ginneken Jong Lammers Mohamed  Hoesein
pomp16a,https://repository.ubn.ru.nl/handle/2066/173155,Follow-up of CT-derived airway wall thickness: Correcting for changes in inspiration level improves reliability,https://doi.org/10.1016/j.ejrad.2016.09.009,Follow-up of CT-derived airway wall thickness: Correcting for changes in inspiration level improves reliability,https://doi.org/10.1016/j.ejrad.2016.09.009,1.0,True,Follow-up of CT-derived airway wall thickness Correcting for changes in inspiration level improves reliability Pompe van Rikxoort Mets Charbonnier Kuhnigk de Koning Oudkerk Vliegenthart Zanen Lammers van Ginneken de Jong Mohamed Hoesein
pomp17,https://repository.ubn.ru.nl/handle/2066/174975,Computed tomographic findings in subjects who died from respiratory disease in the National Lung Screening Trial,https://doi.org/10.1183/13993003.01814-2016,Computed tomographic findings in subjects who died from respiratory disease in the National Lung Screening Trial,https://doi.org/10.1183/13993003.01814-2016,1.0,True,Computed tomographic findings in subjects who died from respiratory disease in the National Lung Screening Trial Pompe Jong Lynch Lessmann Išgum Ginneken Lammers Mohamed  Hoesein
prok20,,CO-RADS - A categorical CT assessment scheme for patients with suspected COVID-19: definition and evaluation,https://doi.org/10.1148/radiol.2020201473,,,,False,CO-RADS - A categorical CT assessment scheme for patients with suspected COVID-19 definition and evaluation Prokop Everdingen Rees  Vellinga Quarles  Ufford Stoger Beenen Geurts Gietema Krdzalic Schaefer-Prokop Ginneken Brink the COVID-19 Standardized Reporting Working Group of the Dutch Radiological Society
riel17,https://repository.ubn.ru.nl/handle/2066/181941,"Malignancy risk estimation of screen-detected nodules at baseline CT: comparison of the PanCan model, Lung-RADS and NCCN guidelines",https://doi.org/10.1007/s00330-017-4767-2,"Malignancy risk estimation of screen-detected nodules at baseline CT: comparison of the PanCan model, Lung-RADS and NCCN guidelines",https://doi.org/10.1007/s00330-017-4767-2,1.0,True,"Malignancy risk estimation of screen-detected nodules at baseline CT comparison of the PanCan model, Lung-RADS and NCCN guidelines Riel Ciompi Jacobs Winkler  Wille Scholten Naqibullah Lam Prokop Schaefer-Prokop Ginneken"
riel19,https://repository.ubn.ru.nl/handle/2066/201229,Observer variability for Lung-RADS categorisation of lung cancer screening CTs: impact on patient management,https://doi.org/10.1007/s00330-018-5599-4,Observer variability for Lung-RADS categorisation of lung cancer screening CTs: impact on patient management,https://doi.org/10.1007/s00330-018-5599-4,1.0,True,Observer variability for Lung-RADS categorisation of lung cancer screening CTs impact on patient management Riel Jacobs Scholten Wittenberg Winkler  Wille Hoop Sprengers Mets Geurts Prokop Schaefer-Prokop Ginneken
rikx09,https://repository.ubn.ru.nl/handle/2066/80377,Automatic segmentation of pulmonary segments from volumetric chest CT scans,https://doi.org/10.1109/TMI.2008.2008968,Automatic segmentation of pulmonary segments from volumetric chest CT scans.,https://doi.org/10.1109/TMI.2008.2008968,0.9933774834437086,True,Automatic segmentation of pulmonary segments from volumetric chest CT scans Rikxoort Hoop Vorst Prokop Ginneken
rikx09b,https://repository.ubn.ru.nl/handle/2066/80370,Automatic lung segmentation from thoracic computed tomography scans using a hybrid approach with error detection,https://doi.org/10.1118/1.3147146,Automatic lung segmentation from thoracic computed tomography scans using a hybrid approach with error detection.,https://doi.org/10.1118/1.3147146,0.9955555555555555,True,Automatic lung segmentation from thoracic computed tomography scans using a hybrid approach with error detection Rikxoort Hoop Viergever Prokop Ginneken
rikx10,https://repository.ubn.ru.nl/handle/2066/88439,Automatic Segmentation of Pulmonary Lobes Robust Against Incomplete Fissures,https://doi.org/10.1109/TMI.2010.2044799,Automatic segmentation of pulmonary lobes robust against incomplete fissures.,https://doi.org/10.1109/TMI.20https://doi.org/10.2044799,0.9934640522875817,False,Automatic Segmentation of Pulmonary Lobes Robust Against Incomplete Fissures Rikxoort Prokop Hoop Viergever Pluim Ginneken
rikx10a,https://repository.ubn.ru.nl/handle/2066/87927,Adaptive local multi-atlas segmentation: application to the heart and the caudate nucleus,https://doi.org/10.1016/j.media.2009.10.001,Adaptive local multi-atlas segmentation: application to the heart and the caudate nucleus.,https://doi.org/10.1016/j.media.2009.https://doi.org/10.001,0.994413407821229,False,Adaptive local multi-atlas segmentation application to the heart and the caudate nucleus Rikxoort Išgum Arzhaeva Staring Klein Viergever Pluim Ginneken
rikx13,https://repository.ubn.ru.nl/handle/2066/140549,Automated segmentation of pulmonary structures in thoracic computed tomography scans: a review,https://doi.org/10.1088/0031-9155/58/17/R187,Automated segmentation of pulmonary structures in thoracic computed tomography scans: a review,https://doi.org/10.1088/0031-9155/58/17/R187,1.0,True,Automated segmentation of pulmonary structures in thoracic computed tomography scans a review Rikxoort Ginneken
ritc16,https://repository.ubn.ru.nl/handle/2066/172195,Computer Vision Tool and Technician as First Reader of Lung Cancer Screening CT Scans,https://doi.org/10.1016/j.jtho.2016.01.021,Computer Vision Tool and Technician as First Reader of Lung Cancer Screening CT Scans,https://doi.org/10.1016/j.jtho.2016.01.021,1.0,True,Computer Vision Tool and Technician as First Reader of Lung Cancer Screening CT Scans Ritchie Sanghera Jacobs Zhang Mayo Schmidt Gingras Pasian Stewart Tsai Manos Seely Burrowes Bhatia Atkar-Khattra van Ginneken Tammemagi Tsao Lam the Pan-Canadian Early Detection of Lung Cancer Study Group
roel12,,Concurrent Endometrial Intraepithelial Carcinoma (EIC) and Serous Ovarian Cancer. Can EIC Be Seen as the Precursor Lesion?,https://doi.org/10.1097/IGC.0b013e3182434a81,,,,False,Concurrent Endometrial Intraepithelial Carcinoma (EIC) and Serous Ovarian Cancer. Can EIC Be Seen as the Precursor Lesion? Roelofsen Kempen Laak Ham Bulten Massuger
rudy14,https://repository.ubn.ru.nl/handle/2066/137671,Comparing algorithms for automated vessel segmentation in computed tomography scans of the lung: The VESSEL12 study,https://doi.org/10.1016/j.media.2014.07.003,Comparing algorithms for automated vessel segmentation in computed tomography scans of the lung: The VESSEL12 study,https://doi.org/10.1016/j.media.2014.07.003,1.0,True,Comparing algorithms for automated vessel segmentation in computed tomography scans of the lung The VESSEL12 study Rudyanto Kerkstra Rikxoort Fetita Brillet Lefevre Xue Zhu Liang Öksüz Ünay Kadipasaoglu Estépar Ross Washko Prieto Hoyos Orkisz Meine Hüllebrand Stöcker Mir Naranjo Villanueva Staring Xiao Stoel Fabijanska Smistad Elster Lindseth Foruzan Kiros Popuri Cobzas Jimenez-Carretero Santos Ledesma-Carbayo Helmberger Urschler Pienn Bosboom Campo Prokop Jong Ortiz-de-Solorzano Muñoz-Barrutia Ginneken
sanc12,https://repository.ubn.ru.nl/handle/2066/110688,Contextual computer-aided detection: Improving bright lesion detection in retinal images and coronary calcification identification in CT scans,https://doi.org/10.1016/j.media.2011.05.004,Contextual computer-aided detection: improving bright lesion detection in retinal images and coronary calcification identification in CT scans.,https://doi.org/10.1016/j.media.2011.05.004,0.9964912280701754,True,Contextual computer-aided detection Improving bright lesion detection in retinal images and coronary calcification identification in CT scans Sánchez Niemeijer Išgum Dumitrescu Suttorp-Schulten Abràmoff Ginneken
scha13a,https://repository.ubn.ru.nl/handle/2066/122870,Bone suppressed images improve radiologists' detection performance for pulmonary nodules in chest radiographs,https://doi.org/10.1016/j.ejrad.2013.09.016,Bone suppressed images improve radiologists' detection performance for pulmonary nodules in chest radiographs,https://doi.org/10.1016/j.ejrad.2013.09.016,1.0,True,Bone suppressed images improve radiologists' detection performance for pulmonary nodules in chest radiographs Schalekamp Ginneken Meiss Peters-Bax Quekel Snoeren Tiehuis Wittenberg Karssemeijer Schaefer-Prokop
scha14,https://repository.ubn.ru.nl/handle/2066/126278,Chest radiography: new technological developments and their applications,https://doi.org/10.1055/s-0033-1363447,Chest Radiography: New Technological Developments and Their Applications,https://doi.org/10.1055/s-0033-1363447,1.0,True,Chest radiography new technological developments and their applications Schalekamp Ginneken Karssemeijer Schaefer-Prokop
scha14a,https://repository.ubn.ru.nl/handle/2066/137680,Computer aided detection improves detection of pulmonary nodules in chest radiographs beyond the support by bone suppressed images,https://doi.org/10.1148/radiol.14131315,Computer-aided detection improves detection of pulmonary nodules in chest radiographs beyond the support by bone-suppressed images,https://doi.org/10.1148/radiol.14131315,0.9846153846153847,True,Computer aided detection improves detection of pulmonary nodules in chest radiographs beyond the support by bone suppressed images Schalekamp Ginneken Koedam Snoeren Tiehuis Wittenberg Karssemeijer Schaefer-Prokop
scha14b,https://repository.ubn.ru.nl/handle/2066/136386,New methods for using computer-aided detection information for the detection of lung nodules on chest radiographs,https://doi.org/10.1259/bjr.20140015,New methods for using computer-aided detection information for the detection of lung nodules on chest radiographs,https://doi.org/10.1259/bjr.20140015,1.0,True,New methods for using computer-aided detection information for the detection of lung nodules on chest radiographs Schalekamp Ginneken Heggelman Imhof-Tas Somers Brink Spee Schaefer-Prokop Karssemeijer
scha16,https://repository.ubn.ru.nl/handle/2066/167509,The Effect of Supplementary Bone-Suppressed Chest Radiographs on the Assessment of a Variety of Common Pulmonary Abnormalities: Results of an Observer Study,https://doi.org/10.1097/RTI.0000000000000195,The Effect of Supplementary Bone-Suppressed Chest Radiographs on the Assessment of a Variety of Common Pulmonary Abnormalities: Results of an Observer Study,https://doi.org/10.1097/RTI.0000000000000195,1.0,True,The Effect of Supplementary Bone-Suppressed Chest Radiographs on the Assessment of a Variety of Common Pulmonary Abnormalities Results of an Observer Study Schalekamp Karssemeijer Cats De Hoop Geurts Berger-Hartog van Ginneken Schaefer-Prokop
scho13a,https://repository.ubn.ru.nl/handle/2066/118196,Computer-Aided Segmentation and Volumetry of Artificial Ground-Glass Nodules at Chest CT,https://doi.org/10.2214/AJR.12.9640,Computer-Aided Segmentation and Volumetry of Artificial Ground-Glass Nodules at Chest CT,https://doi.org/10.2214/AJR.12.9640,1.0,True,Computer-Aided Segmentation and Volumetry of Artificial Ground-Glass Nodules at Chest CT Scholten Jacobs Ginneken Willemink Kuhnigk Ooijen Oudkerk Mali Jong
scho13b,https://repository.ubn.ru.nl/handle/2066/125893,Semi-automatic quantification of subsolid pulmonary nodules: comparison with manual measurements,https://doi.org/10.1371/journal.pone.0080249,Semi-automatic quantification of subsolid pulmonary nodules: comparison with manual measurements,https://doi.org/10.1371/journal.pone.0080249,1.0,True,Semi-automatic quantification of subsolid pulmonary nodules comparison with manual measurements Scholten Hoop Jacobs Amelsvoort-van  Vorst Klaveren Oudkerk Vliegenthart Koning Aalst Mali Gietema Prokop Ginneken Jong
schr18,https://repository.ubn.ru.nl/handle/2066/198322,Lung cancer risk to personalise annual and biennial follow-up computed tomography screening,https://doi.org/10.1136/thoraxjnl-2017-211107,Lung cancer risk to personalise annual and biennial follow-up computed tomography screening,https://doi.org/10.1136/thoraxjnl-2017-211107,1.0,True,Lung cancer risk to personalise annual and biennial follow-up computed tomography screening Schreuder Schaefer-Prokop Scholten Jacobs Prokop Ginneken
schr19,https://repository.ubn.ru.nl/handle/2066/202118,Predicting all-cause and lung cancer mortality using emphysema score progression rate between baseline and follow-up chest CT images: A comparison of risk model performances,https://doi.org/10.1371/journal.pone.0212756,Predicting all-cause and lung cancer mortality using emphysema score progression rate between baseline and follow-up chest CT images: A comparison of risk model performances,https://doi.org/10.1371/journal.pone.0212756,1.0,True,Predicting all-cause and lung cancer mortality using emphysema score progression rate between baseline and follow-up chest CT images A comparison of risk model performances Schreuder Jacobs Gallardo-Estrella Prokop Schaefer-Prokop Ginneken
schr20,https://repository.ubn.ru.nl/handle/2066/225855,Association between the number and size of intrapulmonary lymph nodes and chronic obstructive pulmonary disease severity,https://doi.org/10.7717/peerj.9166,Association between the number and size of intrapulmonary lymph nodes and chronic obstructive pulmonary disease severity,https://doi.org/10.7717/peerj.9166,1.0,True,Association between the number and size of intrapulmonary lymph nodes and chronic obstructive pulmonary disease severity Schreuder Jacobs Scholten Prokop Ginneken Lynch Schaefer-Prokop
schr20c,https://repository.ubn.ru.nl/handle/2066/229529,Typical CT Features of Intrapulmonary Lymph Nodes: A Review,https://doi.org/10.1148/ryct.2020190159,Typical CT Features of Intrapulmonary Lymph Nodes: A Review,https://doi.org/10.1148/ryct.2020190159,1.0,True,Typical CT Features of Intrapulmonary Lymph Nodes A Review Schreuder Jacobs Scholten Ginneken Schaefer-Prokop Prokop
schr21,https://repository.ubn.ru.nl/handle/2066/234393,Combining pulmonary and cardiac computed tomography biomarkers for disease-specific risk modelling in lung cancer screening,https://doi.org/10.1183/13993003.03386-2020,CT-Detected Subsolid Nodules: A Predictor of Lung Cancer Development at Another Location?,https://doi.org/10.3390/cancers13112812,0.2830188679245283,False,Combining pulmonary and cardiac computed tomography biomarkers for disease-specific risk modelling in lung cancer screening Schreuder Jacobs Lessmann Broeders Silva Išgum Jong Sverzellati Prokop Pastorino Schaefer-Prokop Ginneken
